{
  "generated_from": [
    {
      "path": "wucios/releases/noether-forge-v2.4.0/alpine-input-lock.json",
      "schema": "wucios.noether_forge.alpine_input_lock.v2",
      "sha256": "ea253e106721a487706a5c37e30f25a46bcc3013c1812152c5954a1e02fb2d10"
    },
    {
      "path": "wucios/releases/noether-forge-v2.4.0/package-lock.json",
      "schema": "wucios.noether_forge.package_lock.v2",
      "sha256": "8e6584aa708333e722fb696a0dbc6c7ff262d29f47b40aa8cda9c70fc2156b79"
    },
    {
      "path": "wucios/releases/noether-forge-v2.4.0/initramfs-patch-spec.json",
      "schema": "wucios.noether_forge.initramfs_patch_spec.v1",
      "sha256": "99dfc493424ff575cab8d7353b9a23690b5a06baffac22e56c38b6bb3a93fd4a"
    }
  ],
  "inventory_status": "review-input-only",
  "items": [
    {
      "artifact_filename": "alpine-base-3.24.1-r0.apk",
      "digests": {
        "sha256": "1587a0a8f269ec26b481ca8489a8ed94dc1cfe9c6c3597cf2a68e2c7cab025e2",
        "sha512": "NOASSERTION"
      },
      "export_review": {
        "classification": "NOASSERTION",
        "review_state": "not-determined"
      },
      "firmware": {
        "content_state": "not-determined",
        "redistribution_review": "not-reviewed"
      },
      "item_id": "alpine-apk-container-member:alpine-base-3.24.1-r0.apk",
      "kind": "alpine-apk-container-member",
      "license_metadata": {
        "declared_expression": "NOASSERTION",
        "evidence": "NOASSERTION",
        "review_state": "not-reviewed"
      },
      "notices": {
        "provided": "NOASSERTION",
        "required": "NOASSERTION",
        "review_state": "not-reviewed"
      },
      "origin": {
        "acquisition": "container-member",
        "artifact_url": "NOASSERTION",
        "container_filename": "alpine-extended-3.24.1-x86_64.iso",
        "container_url": "https://dl-cdn.alpinelinux.org/alpine/v3.24/releases/x86_64/alpine-extended-3.24.1-x86_64.iso",
        "member_path": "/apks/x86_64/alpine-base-3.24.1-r0.apk",
        "record_state": "locked",
        "repository_url": "NOASSERTION"
      },
      "package": "alpine-base",
      "redistribution_review": "not-cleared",
      "size_bytes": 1322,
      "source_metadata": {
        "origin_package": "NOASSERTION",
        "review_state": "not-reviewed",
        "source_archive_digest": "NOASSERTION",
        "upstream_source_url": "NOASSERTION"
      },
      "version": "3.24.1-r0"
    },
    {
      "artifact_filename": "alpine-baselayout-3.7.2-r1.apk",
      "digests": {
        "sha256": "b41ddec2088fd7c794ab4fcd79945016d61eadcab56d2414c51463c8c13e7c65",
        "sha512": "NOASSERTION"
      },
      "export_review": {
        "classification": "NOASSERTION",
        "review_state": "not-determined"
      },
      "firmware": {
        "content_state": "not-determined",
        "redistribution_review": "not-reviewed"
      },
      "item_id": "alpine-apk-container-member:alpine-baselayout-3.7.2-r1.apk",
      "kind": "alpine-apk-container-member",
      "license_metadata": {
        "declared_expression": "NOASSERTION",
        "evidence": "NOASSERTION",
        "review_state": "not-reviewed"
      },
      "notices": {
        "provided": "NOASSERTION",
        "required": "NOASSERTION",
        "review_state": "not-reviewed"
      },
      "origin": {
        "acquisition": "container-member",
        "artifact_url": "NOASSERTION",
        "container_filename": "alpine-extended-3.24.1-x86_64.iso",
        "container_url": "https://dl-cdn.alpinelinux.org/alpine/v3.24/releases/x86_64/alpine-extended-3.24.1-x86_64.iso",
        "member_path": "/apks/x86_64/alpine-baselayout-3.7.2-r1.apk",
        "record_state": "locked",
        "repository_url": "NOASSERTION"
      },
      "package": "alpine-baselayout",
      "redistribution_review": "not-cleared",
      "size_bytes": 8281,
      "source_metadata": {
        "origin_package": "NOASSERTION",
        "review_state": "not-reviewed",
        "source_archive_digest": "NOASSERTION",
        "upstream_source_url": "NOASSERTION"
      },
      "version": "3.7.2-r1"
    },
    {
      "artifact_filename": "alpine-baselayout-data-3.7.2-r1.apk",
      "digests": {
        "sha256": "2eaa18c8535f6c50bd5846b1a3c27edd9b45a2672d81f13e1f8bf79bd18c41e3",
        "sha512": "NOASSERTION"
      },
      "export_review": {
        "classification": "NOASSERTION",
        "review_state": "not-determined"
      },
      "firmware": {
        "content_state": "not-determined",
        "redistribution_review": "not-reviewed"
      },
      "item_id": "alpine-apk-container-member:alpine-baselayout-data-3.7.2-r1.apk",
      "kind": "alpine-apk-container-member",
      "license_metadata": {
        "declared_expression": "NOASSERTION",
        "evidence": "NOASSERTION",
        "review_state": "not-reviewed"
      },
      "notices": {
        "provided": "NOASSERTION",
        "required": "NOASSERTION",
        "review_state": "not-reviewed"
      },
      "origin": {
        "acquisition": "container-member",
        "artifact_url": "NOASSERTION",
        "container_filename": "alpine-extended-3.24.1-x86_64.iso",
        "container_url": "https://dl-cdn.alpinelinux.org/alpine/v3.24/releases/x86_64/alpine-extended-3.24.1-x86_64.iso",
        "member_path": "/apks/x86_64/alpine-baselayout-data-3.7.2-r1.apk",
        "record_state": "locked",
        "repository_url": "NOASSERTION"
      },
      "package": "alpine-baselayout-data",
      "redistribution_review": "not-cleared",
      "size_bytes": 10792,
      "source_metadata": {
        "origin_package": "NOASSERTION",
        "review_state": "not-reviewed",
        "source_archive_digest": "NOASSERTION",
        "upstream_source_url": "NOASSERTION"
      },
      "version": "3.7.2-r1"
    },
    {
      "artifact_filename": "alpine-conf-3.22.0-r0.apk",
      "digests": {
        "sha256": "7f803c1073765681ad9abf4336c0510dc4332ac241db3ed761d91f2f019d2b04",
        "sha512": "NOASSERTION"
      },
      "export_review": {
        "classification": "NOASSERTION",
        "review_state": "not-determined"
      },
      "firmware": {
        "content_state": "not-determined",
        "redistribution_review": "not-reviewed"
      },
      "item_id": "alpine-apk-container-member:alpine-conf-3.22.0-r0.apk",
      "kind": "alpine-apk-container-member",
      "license_metadata": {
        "declared_expression": "NOASSERTION",
        "evidence": "NOASSERTION",
        "review_state": "not-reviewed"
      },
      "notices": {
        "provided": "NOASSERTION",
        "required": "NOASSERTION",
        "review_state": "not-reviewed"
      },
      "origin": {
        "acquisition": "container-member",
        "artifact_url": "NOASSERTION",
        "container_filename": "alpine-extended-3.24.1-x86_64.iso",
        "container_url": "https://dl-cdn.alpinelinux.org/alpine/v3.24/releases/x86_64/alpine-extended-3.24.1-x86_64.iso",
        "member_path": "/apks/x86_64/alpine-conf-3.22.0-r0.apk",
        "record_state": "locked",
        "repository_url": "NOASSERTION"
      },
      "package": "alpine-conf",
      "redistribution_review": "not-cleared",
      "size_bytes": 65626,
      "source_metadata": {
        "origin_package": "NOASSERTION",
        "review_state": "not-reviewed",
        "source_archive_digest": "NOASSERTION",
        "upstream_source_url": "NOASSERTION"
      },
      "version": "3.22.0-r0"
    },
    {
      "artifact_filename": "alpine-keys-2.6-r0.apk",
      "digests": {
        "sha256": "dd211936d544f4050924ce8aec078d24e7b1b036ae70b30bd07867349587c708",
        "sha512": "NOASSERTION"
      },
      "export_review": {
        "classification": "NOASSERTION",
        "review_state": "not-determined"
      },
      "firmware": {
        "content_state": "not-determined",
        "redistribution_review": "not-reviewed"
      },
      "item_id": "alpine-apk-container-member:alpine-keys-2.6-r0.apk",
      "kind": "alpine-apk-container-member",
      "license_metadata": {
        "declared_expression": "NOASSERTION",
        "evidence": "NOASSERTION",
        "review_state": "not-reviewed"
      },
      "notices": {
        "provided": "NOASSERTION",
        "required": "NOASSERTION",
        "review_state": "not-reviewed"
      },
      "origin": {
        "acquisition": "container-member",
        "artifact_url": "NOASSERTION",
        "container_filename": "alpine-extended-3.24.1-x86_64.iso",
        "container_url": "https://dl-cdn.alpinelinux.org/alpine/v3.24/releases/x86_64/alpine-extended-3.24.1-x86_64.iso",
        "member_path": "/apks/x86_64/alpine-keys-2.6-r0.apk",
        "record_state": "locked",
        "repository_url": "NOASSERTION"
      },
      "package": "alpine-keys",
      "redistribution_review": "not-cleared",
      "size_bytes": 12200,
      "source_metadata": {
        "origin_package": "NOASSERTION",
        "review_state": "not-reviewed",
        "source_archive_digest": "NOASSERTION",
        "upstream_source_url": "NOASSERTION"
      },
      "version": "2.6-r0"
    },
    {
      "artifact_filename": "alpine-release-3.24.1-r0.apk",
      "digests": {
        "sha256": "14b514270d0b8fe028b25d15028a134150f29cd48666248d4d083b95c5120d56",
        "sha512": "NOASSERTION"
      },
      "export_review": {
        "classification": "NOASSERTION",
        "review_state": "not-determined"
      },
      "firmware": {
        "content_state": "not-determined",
        "redistribution_review": "not-reviewed"
      },
      "item_id": "alpine-apk-container-member:alpine-release-3.24.1-r0.apk",
      "kind": "alpine-apk-container-member",
      "license_metadata": {
        "declared_expression": "NOASSERTION",
        "evidence": "NOASSERTION",
        "review_state": "not-reviewed"
      },
      "notices": {
        "provided": "NOASSERTION",
        "required": "NOASSERTION",
        "review_state": "not-reviewed"
      },
      "origin": {
        "acquisition": "container-member",